,Type,Name,Age,Gender,MaturitySize,FurLength,Vaccinated,Dewormed,Sterilized,Health,Quantity,Fee,State,RescuerID,VideoAmt,Description,PetID,PhotoAmt,AdoptionSpeed,ColorName_x,ColorName_y,ColorName,BreedName_x,BreedName_y,StateName_x
610,1,Bulls Eye,2,2.0,2.0,1,2,1,2,1,1,0,41326,aa66486163b6cbc25ea62a34b11c9b91,0,"Bulls Eye is named as such from the cute marking of her face. Her body is entirely white. She is absolutely gorgeous, good natured and adorable. Vaccination and neutering are compulsory, cost to be borne by adopter. Please call if you can give her a good home.",75ee37fa5,1.0,3,Black,Brown,White,Terrier,Mixed Breed,Selangor
611,1,Lola,2,,2.0,1,2,2,2,1,1,0,41326,aa66486163b6cbc25ea62a34b11c9b91,0,Lola was rescued from a drain in Taman OUG by a resident who heard her cry while he was out jogging. She is an adorable healthy pup. Vaccination and neutering are compulsory. No tying up or caging unless necessary for short periods. Please call if interested.,24e800fa6,5.0,2,Black,Brown,,Terrier,Mixed Breed,Selangor
612,1,Alisa,2,2.0,2.0,2,3,3,2,1,1,0,41326,fa90fa5b1ee11c86938398b60abc32cb,0,Medium size upon maturity lovely puppy looking for a forever home. Commitment to spay is compulsory. Interested to adopt pls contact Rachel,ff8e7c016,3.0,3,Black,Brown,White,Terrier,Mixed Breed,Selangor
613,1,"Keiko, Suki & Reiki",2,2.0,2.0,1,2,2,2,1,3,0,41326,aa66486163b6cbc25ea62a34b11c9b91,0,"The three sisters are chubby, cute and adorable. Keiko and Suki are almost identical, with their white coat and khaki brown patches. Reiki is white with black spots. Keiko is the sweet and quiet one, happy to just fall asleep on your lap. Suki is more active while Reiki is the adventurer who loves to explore her surroundings. Looking for good homes. Adult size is estimated medium to big size, (check out the picture of their mother) Adopters must be willing to vaccinate and spay them. We are also looking for a home for their mom, Sai E. She is a gentle dog, about 3 years old. Don't bite or chew, street smart and knows how to poop on grass. Please give her the love she deserves.",7c9dc0791,14.0,2,Black,Brown,White,Terrier,Mixed Breed,Selangor
614,1,Cheeky And Chucky,1,2.0,2.0,1,2,1,2,1,1,100,41326,a042471e0f43f2cf707104a1a138a7df,0,"Cheeky and chucky were abandoned pups together with their daddy in the market. They look like spitz mixed, with heathy condition. Adoption fee is required to treat and sustain all unadoptable dogs at the shed. Adopter must be willing to spay and vaccinate. Upfront spaying fee is required for the future spaying at our panel vet. Please call for appointment.",7ed1216f9,6.0,3,Black,Brown,White,Spitz,Mixed Breed,Selangor
615,1,Colby & Kaylee,1,3.0,2.0,2,2,1,2,1,2,0,41326,a042471e0f43f2cf707104a1a138a7df,0,"They love singing! They sing when they just wake uo, they sing when they are hungry, they sing when they sleep. They even chase my male puppy around asking for milkmilk from him. ************************************************** Colby and Kaylee are brother and sister. They are about 4 weeks old. The mama dog suffered from vagina prolapse when she delivered her litter. The mama dog is not good at nursing them at all. However, these two little fella are very healthy! The dog owner intended to send these 2 pups to SPCA as she is away for holidays. I rescued them and took them back & take care of them for a wek secretly. Thank god they are not making too much noise except stinking up my bathroom! Now they are up for adoption.",8df053c7e,13.0,2,Black,Brown,White,Spitz,Mixed Breed,Selangor
616,1,Julie,24,2.0,2.0,2,2,2,1,1,1,0,41326,aa66486163b6cbc25ea62a34b11c9b91,0,Julie is a beautiful dog. She was abandoned by her owner at a car wash in Ara Damansara and currently cared for by security guards there. She is a good watchdog. Adopter must pay vaccination and neutering cost. Please call if u can give her a good home/,39818f12c,3.0,4,Black,Brown,White,Spitz,Mixed Breed,Selangor
617,1,Eline,24,2.0,2.0,2,1,1,1,1,1,0,41326,fa90fa5b1ee11c86938398b60abc32cb,0,Beautiful dog looking for a home sweet home. Interested to adopt pls contact Amy ,840fbaeba,3.0,3,Black,Brown,White,,,Selangor
618,1,Koly,3,2.0,2.0,2,3,3,2,1,1,0,41326,fa90fa5b1ee11c86938398b60abc32cb,0,Koly is a smaller breed dog. Her size is bigger than a persian cat but smaller than a medium size dog. Lovely and intelligent. . If u are interested to adopt pls contact Rachel to view the dog in real life.,bfc46890f,9.0,3,Black,Brown,White,Spitz,Mixed Breed,Selangor
619,1,Victor,5,1.0,2.0,2,2,1,2,1,1,0,41326,aa66486163b6cbc25ea62a34b11c9b91,0,Victor is a handsome spitz cross. He was rescued from the pound in February with a few others. His name was given after he emerged victorious from the jaws of death and fended off a canine disease. He has recovered fully and now looking for a loving home. He is playful but shy and well-behaved. Please give him the love that he deserves.,7c542e43e,2.0,3,Black,Brown,White,Spitz,Mixed Breed,Selangor
620,1,Clara,36,2.0,2.0,1,1,1,1,1,1,0,41326,aa66486163b6cbc25ea62a34b11c9b91,0,"Clara is a very steady, calm dog. She was found in Damansara Kim but we couldn't track her owner after weeks. Hence would like to find her a good home. She makes a wonderful companion and great for first time dog owners. Vaccination and neutering cost to be borne by adopter. Please call if u can give her a good home.",c9d333b09,5.0,4,Black,Brown,White,Doberman Pinscher,Mixed Breed,Selangor
621,1,Patrick (Gentle & Sweet Boy),8,1.0,2.0,1,1,1,1,1,1,0,41326,f873597f23a3ac060c5c7c3526b71344,0,"Patrick is very affectionate and a playful boy. He is sweet, alert and friendly. He is a very good natured dog and will be great to find a responsible owner who will care for him, and give him a forever home. He was abandoned by his owner the moment he grew bigger. Owner dumped him in Ara Damansara Industrial Area. We are looking for an adopter/fosterer, no caging or tying up for long hours. If you can give Patrick a forever home please call me. Tony",6709f43e8,3.0,4,Black,Brown,White,Beagle,Mixed Breed,Selangor
622,1,Patches,11,2.0,2.0,1,2,2,2,1,1,0,41326,90191b06d602e8d45b4ce25dd22c6a3e,0,"She is a lost beagle who needs love and care from a good family. She is good tempered, friendly and easy to manage, a great a family dog. She will be spayed before handing over to her new home.",4a9fa9d9e,2.0,2,Black,Brown,White,Beagle,Mixed Breed,Selangor
623,1,HSIAU HWONG & HSIAU HEY,3,3.0,2.0,1,2,1,2,1,2,0,41326,90191b06d602e8d45b4ce25dd22c6a3e,0,"THESE PUPPIES MOTHER- BEAGLE LAST SEEN WONDERING NEAR THE SHOPS PLAYING WITH THEM. NOW WE DON'T KNOW WHERE SHE WENT. BOTH THE PUPPIES, ABOUT 3 MONTHS OLD, ARE SO CUTE AND HEALTHY... I AM TAKING CARE OF THEM TILL NOW. I AM LOOKING FOR A GOOD LOVING OWNER TO TAKE CARE OF THEM. GOD BLESS THEM A GOOD HOME. THE BROWN AND WHITE PUP HAS BEEN ADOPTED BUT THE BLACK AND WHITE ONE IS AVAILABLE.",5043a32cb,3.0,3,Black,Brown,White,Beagle,Mixed Breed,Selangor
624,1,Emma,2,2.0,2.0,1,1,1,2,1,1,0,41326,fa90fa5b1ee11c86938398b60abc32cb,0,"Emma had a lovely family. Unfortunately , her litter owner who is only 4 years old had asthma and Dr advise not to keep any pet. Therefore she was sent away to a fosterer and waiting for a sweet home. Commitment to spay her is compulsory. If u are interested to adopt pls contact Albert",c787ee619,3.0,3,Black,Brown,White,Beagle,Mixed Breed,Selangor
625,1,Jingle,9,2.0,2.0,1,1,1,1,1,1,0,41326,a042471e0f43f2cf707104a1a138a7df,0,"Extremely playful & adorable. loves running around, loves eating, gets along with other dogs well. She has been spayed & fully vaccinated. Adopter has to reimburse the medical cost incurred in order to help other homeless dogs. Preferably keeping Jingle as an indoor pet.",a993cd91a,7.0,2,Black,Brown,White,Jack Russell Terrier,Mixed Breed,Selangor
626,1,Mascara,3,2.0,2.0,1,1,1,2,1,1,0,41326,920d8cc91447e6c6b7c817b399b760ce,0,"Mascara is her name... because she looks like put on loads of it then cried over a broken heart till it smeared up around her eyes. But a broken heart she has not! She is the bubbliest, loving-est, most heart-melting puppy I have ever met. I found her 2 weeks ago with a maggot wound, a fever and swollen lymph nodes. After antibiotics she is up and jolly, ready for a loving new home. She will make you laugh with her antics and her adorable expression when she wants your forgiveness after doing something naughty. Her daddy is an abandoned jack russell terrier mixed so that explains her beautiful, unique markings. She needs a family that is willing to play with her to keep her happy, love her as unconditionally as she will love them and most of all, protect her from all sorts of harm. SO, LOOKING FOR A FURBABY THAT WILL MAKE YOU SMILE? Mascara may just be the one to brighten up your day.",2f0abd493,6.0,3,Black,Brown,White,,,Selangor
627,1,Scruffy,3,2.0,2.0,2,1,1,2,1,1,0,41326,e5f791909629e34d5dcef44bbaf3da37,2,"Scruffy is looking for a good home/family who will spend lots of time with her, take her for long walks and most importantly give her lots of love... ************************************************** This is Scruffy's story: About a month ago, I was at my usual coffee shop in Hulu Kelang this morning, when I saw this tiny puppy wandering round the shop. She was really frail and quite dirty with a skin condition, and was looking for a kind person to cuddle up to and not so much for food. But of course Malaysians being Malaysians, most of them shoo-ed her away and some even kicked her. The coffee shop owner then informed me that her mother had recently been killed - someone had poisoned her. As I usually have a small amount of dog food with me in the car, I gave her some. She ate a little but just wanted to be petted. She then went to another table curled up at the feet of this old man. Thankfully this man did not kick her. I asked several people if they would take her, but of course none would. In the end, I asked the shop owner for a box and brought her home. I just could not bring myself to leave her there. I took her to the vet and it was confirmed that she had a severe case of sarcoptic mange. She was treated with Ivermectin for 5 weeks and she is now a healthy, active puppy. We're not entirely sure what breed she is, but she looks like she could have some Jack Russell in her and possibly some Dalmation as well as she has quite a lot of spots... She has just received her first vaccination and will be completing the remaining 2 shots soon. She has a very good temperament and is good with other dogs. She is curious about our cat and has shown no signs of aggression towards it. She is very playful and is a fast learner. For more pictures etc of Scruffy, please visit www.cleopatrathelabrador.blogspot.com",763264fa2,8.0,3,Black,Brown,White,Jack Russell Terrier,Mixed Breed,Selangor
628,1,JD,2,1.0,3.0,1,1,1,2,1,1,0,41326,aa66486163b6cbc25ea62a34b11c9b91,0,"JD is looking for a new home. Playful and adorable pup. He is among 8 siblings, all of whom have been adopted (see Do-Re-Mi-La-Ti-Do). Adopter must be willing to vaccinate and castrate him. No tying up or caging for long hours. Thank you for all your interest. His adopter Li Hui has decided to keep him after all.",f8d16f3ef,1.0,1,Black,Brown,White,Belgian Shepherd Malinois,Mixed Breed,Selangor
629,1,Leo,3,,2.0,1,1,1,3,1,1,0,41326,1f4c6fe92431092dd0b04b7082dc756c,0,"I'm helping a friend who leaves in apartment to get his puppy of 3 mth adopted coz management doesn't given him time of a week to get him adopted.he is vaccinated ,healthy.he desperately looking for a fmly for his beloved pet.hope it gets a home soon.",b5b9c3c05,2.0,1,Black,Brown,,Belgian Shepherd Malinois,Mixed Breed,Selangor
630,1,Yumi,5,2.0,1.0,2,1,1,2,1,1,0,41326,aa66486163b6cbc25ea62a34b11c9b91,0,"Yumi is sweet, gentle and intelligent. She enjoys going for walks and has a unique marking: one ear flops while the other stands upright. Owner is giving her up due to a busy schedule. Looking for a loving home.",d0ef38cff,2.0,2,Black,Brown,White,,,Selangor
631,1,Mixed Pit Bull,1,2.0,2.0,1,2,2,2,1,7,100,41326,5b768ed9cc0a2fb07e077a814c80a0be,0,There are 7 female cute mixed pit bull to adopt. Already can walk. Only available for Klang Valley Malaysian. Adoption fee is to spay the dog mother. The most important rules are allow me to visit at adopter's house. Not lost contact after took the puppy. Anyone interested can choose and book first. After confirmed the owners will give the puppies before school holiday.,4a9d058f6,5.0,2,Black,Brown,White,Pit Bull Terrier,Mixed Breed,Selangor
632,1,BRUNO,36,1.0,3.0,1,1,1,1,1,1,0,41326,aa66486163b6cbc25ea62a34b11c9b91,0,"Handsome Bruno is a stocky dog with a unique brindle coat, white chest and muscular body. The most obedient and well-behaved dog I have ever met. Yet has a mind of his own. Loves going for long walks, toilet trained to pee and poo during walks. Extremely smart and devoted to his master if he is well taken care of. Loves other doggie companion, especially females:) Makes a great pet and good watchdog. No tying up or caging please.",23379775f,10.0,3,Black,Brown,White,Boxer,Mixed Breed,Selangor
633,1,Callie,1,2.0,2.0,1,3,3,2,1,1,0,41326,fa90fa5b1ee11c86938398b60abc32cb,0,Cute and lovely puppy looking for a home sweet home. Commitment to spay is compulsory. If u are interested to adopt pls contact Rachel,6114449db,4.0,3,Black,Brown,White,Rat Terrier,Mixed Breed,Selangor
634,1,Chloe,12,2.0,1.0,1,3,3,1,1,1,0,41326,fa90fa5b1ee11c86938398b60abc32cb,0,Owner migrating. Alrdy spayed. Looking for a loving home. If u interested to give her a home. Pls Rachel,26d17afbd,1.0,3,Black,Brown,White,Rat Terrier,Mixed Breed,Selangor
635,1,Dalmation Mix,3,1.0,2.0,1,1,1,3,1,1,0,41326,fa90fa5b1ee11c86938398b60abc32cb,0,Lovely puppy looking for a forever home pls contact Joyceline,fc9cf8b8d,1.0,0,Black,Brown,White,Dalmatian,Mixed Breed,Selangor
636,1,Reena,84,2.0,2.0,1,1,1,1,1,1,0,41326,eae1ae577b7a53f7ef8945003d2d0b45,0,the owner is migrating.. neeeds to find a good home.. its a very good watch dog and its not a fussy eater..,55cdf4eda,1.0,4,Black,Brown,White,German Shepherd Dog,Mixed Breed,Selangor
637,1,Scooby,37,1.0,4.0,1,1,1,1,1,1,50,41326,6f40a7acfad5cc0bb3e44591ea446c05,0,"YaabbaaadaabaaaDooooo!!! I look like Scooby Doo no? I got myself stranded at a emergency stairwell behind a shop for days. I was too terrified to go anywhere. Then weird creatures came from above and took me away in some space ship and I was lying down on this table with bright lights. After which when I woke up I felt something was missing between my legs. I'm a hygiene freak. I'd prefer my space to be spotless!! I pee shooting out of the cage unlike Rambo. He thinks he's human he pees in his bowl. I swear! But as for my poop, I still haven't figure a way to shoot that out of my cage yet.But I'd stay away from it. I need lots of space to run coz I have really long legs n huge paws. I need exercise!!! I think with more exercise I'd be able to scare off some thieves with my huge physique. I'm kinda mixed so I'm not as big as a real great dane. See... I'm manageable! U want a toughie to run with u? I'm d dog!",cb0c04621,2.0,1,Black,Brown,White,Great Dane,Mixed Breed,Selangor
638,1,Cocker Spaniel Mummy & Puppies,1,3.0,2.0,1,2,2,2,1,2,100,41326,4d2400be2e2e78265f5c84345b7a3415,0,"Dear heartless owner, I wonder what were your last words to Cocker Spaniel mummy & her poor puppies before you dump them mercilessly near one of our feeding area? Poor mummy had tears on her eyes when we took her back & always wanted to cling and hug on us & had so much affection to show & share with us. Mummy has been schedule for spaying & she is available for adoption thereafter. As for her two precious puppies, they are up for adoption. Can anyone give them a loving, caring, forever home they truly deserves? They should be around 1 month plus. PJ area. Adoption saves lives ! Do contact if you can.",baf49463a,6.0,3,Black,Brown,White,Cocker Spaniel,Mixed Breed,Selangor
639,1,Amber C,12,2.0,2.0,1,1,1,1,1,1,0,41326,aa66486163b6cbc25ea62a34b11c9b91,0,"Amber is a gorgeous tricolor border collie cross with a personality to match. She is happy-go-lucky, very well behaved and an excellent watchdog. Enjoys her daily walks and will add sunshine to your house. She knows basic commands such as come, sit and go inside to her cage. No tying up or caging unless necessary for short periods. for long hours. Her owner has to move to a condo and can't take her along. Please give her a good home",751412a89,8.0,4,Black,Brown,White,Border Collie,Mixed Breed,Selangor
640,1,Totoro,3,1.0,2.0,2,2,1,2,1,1,0,41326,5645f8bc8caac142fe7f4e3ab4369d45,0,"Totoro is active and highly alert puppy. A perfect play companion and watch dog. Young, small yet bold and fearless. Give him a safe FOREVER HOME and let him be your hero. Some training will be required as with all dogs.",22992ecd0,5.0,1,Black,Brown,White,Toy Fox Terrier,Mixed Breed,Selangor
641,1,Rambo,2,1.0,2.0,1,2,1,2,1,1,0,41326,aa66486163b6cbc25ea62a34b11c9b91,0,Rambo is a cute puppy just under two months old. His name comes from his unique brindle coat and his cool character. Also has a black muzzle but not as distinct as his brothr Tiger due to his fur color. Active and loves to play with humans. Adopter must vaccinate and spay him. Please give him a good home. Check out his brother Tiger too.,0ecc1200a,4.0,2,Black,Brown,White,Black Mouth Cur,Mixed Breed,Selangor
642,1,Munchkin,12,1.0,2.0,2,1,1,1,1,1,0,41326,72da73fe3eec6c512cc04371f97760b5,0,"Munchkin is a very smart and lovely dog. He is loyal, adorable, playful and sometimes fearful when he gets nervous or uncomfortable. I would say he is unique in his own way. he also loves being hugged and cuddled. Munchkin would best suit a family that: 1)Are dog lovers. You should have experience and basic knowledge about dogs. 2)No kids under the age of 12 unless the parents are able to give correct guidance to their kids and Munchkin. 3)Munchkin gets along well with other dogs bit also needs correct guidance and supervision. Please do contact us if you would like to know more about Munchkin :)",1d30559d8,5.0,3,Black,Brown,White,Shetland Sheepdog Sheltie,Mixed Breed,Selangor
643,1,Clowy,5,2.0,2.0,1,3,3,2,1,1,0,41326,b9b990851a2e6a717e382d635a3827dc,0,"I am currently fostering Clowy, she is a very loving and loyal dog and she is train quite well. She gets along great with people and my 3 cats. She dose good indoors and outdoors. she loves too play, she's a pleasure to have around. Urgently looking for a good loving home / foster home.",c240d153f,5.0,1,Black,Brown,White,Jack Russell Terrier,Dalmatian,Selangor
644,1,Monster,4,1.0,2.0,1,2,2,2,1,1,0,41326,fe0c69137699320417b017d7f80edd4e,0,"Very cute puppy, clean and smart, friendly. Mixed Dalmation with PitBull. 4 months.",66bf65c82,4.0,4,Black,Brown,White,Pit Bull Terrier,Dalmatian,Selangor
645,1,Dalmation,2,,1.0,2,1,3,3,1,5,0,41326,16e5a100c3e0b30f933af3fe9ffdfbf0,0,The puppies are so cute and playful Please contact : Miss Ranji,79b514f79,1.0,0,Black,Brown,,Dalmatian,Dalmatian,Selangor
646,1,Polly,4,2.0,2.0,2,1,1,1,1,1,0,41326,fa90fa5b1ee11c86938398b60abc32cb,0,She was found wandering around a playground of a housing estate with a red collar. A group of boys was throwing stones at her. We strongly believe that she was owned by someone and is a lost dog based on her behaviour. If you are interested to adopt or if you are her owner pls call me.,6d9b202c9,10.0,3,Black,Brown,White,Mixed Breed,Bluetick Coonhound,Selangor
647,1,2 Sibling Pups (Toilet-Trained ),2,2.0,2.0,2,1,1,2,1,2,0,41326,3b074cadd2350de62dca7056b9bab6f4,0,FOR serious adopters only! Requirements for Adoption: ========================= All adoptions are subject to an interview and house check. Medical Cost of vaccinations and neutering to be borne by adopter. Vaccinations and neutering/spaying at 6 months of age are COMPULSORY.,830b62870,22.0,3,Black,Brown,White,Mixed Breed,Terrier,Selangor
648,1,"Baby, Lucky & Scruffy",2,3.0,2.0,1,2,2,2,1,3,0,41326,fa29395df335dfeb1ba7edd9919d54f4,0,"Scruffy ""The Mama"" and her puppy Baby looking for loving home, we got to know Scruffy previous owner abandon them in empty house without food n water, She is very sweet and smart, listen to command & we believe she is terrier mix, Scruffy's pup is female 2 months old we named her 'Baby', Baby is so adorable and cute. Both mum n pup is very healthy. Along this, we also have another abandon pup 'Lucky' he is doberman mix, he is 5 months old If you able to giving them loving home, please contact me via what's app. P/S: Pets are not disposable! Pets are family and a lifetime commitment",2edd45e56,5.0,2,Black,Brown,White,Mixed Breed,Terrier,Selangor
649,1,Ally,1,2.0,2.0,1,2,2,2,1,1,0,41326,aa66486163b6cbc25ea62a34b11c9b91,0,"Ally is among six siblings looking for a home. She is active and adventurous, even at this young age. Vaccination and neutering are compulsory, cost to be borne by adopter. Viewing on Sundays only. Please call if you can give her a good home. Adopted 27 July by Eddie and Rachel.",f89f0e01d,3.0,2,Black,Brown,White,Mixed Breed,Terrier,Selangor
650,1,Feather,2,2.0,2.0,2,1,1,2,1,1,0,41326,fa90fa5b1ee11c86938398b60abc32cb,0,Active and playful puppies. Looking for a goodhome. Size of maturity should be either small or medium size. No caging or chaining for long hour except for precautionary purposes. Commitment to spay is compulsory.,bec6cc26b,6.0,1,Black,Brown,White,Mixed Breed,Terrier,Selangor
651,1,Donny,2,1.0,2.0,1,2,2,2,1,1,0,41326,aa66486163b6cbc25ea62a34b11c9b91,0,"This pair of siblings are chubby and sweet. Marie is black and tan, while Donny is black and white with a panda face. They are happy pups. Donny is a feisty, playful pup. Very smart and charming but you must have TIME to train him. Not for busy folks. He loves to play with older dogs. Vaccination and neutering are COMPULSORY. No tying up or caging for long hours. Only for people who have time to nurture a pup.",75642f3e5,7.0,3,Black,Brown,White,Mixed Breed,Terrier,Selangor
652,1,2 Sisters,2,2.0,2.0,1,2,1,2,1,2,0,41326,aa66486163b6cbc25ea62a34b11c9b91,0,"They were three but one has been adopted. The two sisters always hang out together. They are toilet trained on grass and generally obedient. Very playful and will come when called. Knows how to go into cage. Happy to have a chew bone and loves to be around people. Vaccination and neutering are compulsory, cost borne by adopter. Please call if you can give them a good home.",7dcbe3383,10.0,4,Black,Brown,White,Mixed Breed,Terrier,Selangor
653,1,Archie,1,1.0,2.0,2,2,2,2,1,1,0,41326,aa66486163b6cbc25ea62a34b11c9b91,0,"Archie is among six siblings looking for a home. His fur is tricolor and he is a sturdy good looking pup. Vaccination and neutering are compulsory, cost to be borne by adopter. Viewing on Sundays only. Please call if u can give him a good home. Adopted 21 July by Michael Chin.",6fc2970d6,4.0,2,Black,Brown,White,Mixed Breed,Terrier,Selangor
654,1,Baby & Piper,36,3.0,2.0,1,1,1,1,1,2,0,41326,aa66486163b6cbc25ea62a34b11c9b91,0,"These two lovely dogs are ooking for a new home as their owner has moved to a condo. They are both obedient and lovable. Attached to each other, so would like to be rehomed together. Baby is a 5-year-old terrier cross. Spayed and healthy. Active, alert and good guard dog. Weighs 14 kgs. Piper is Baby's son, 3 years old. He is crossed with flat-coat retriever. Handsome and shy with strangers but warms up easily. Very clever, knows tricks like shake hands and play dead. Weighs 18 kgs. Both are trained not to run out of the house when gate is opened. Loves daily walks. No tying up or caging. Please help give them a good home. Call if interested.",6e21edd32,5.0,3,Black,Brown,White,Flat-coated Retriever,Terrier,Selangor
655,1,Hunter,3,1.0,3.0,1,1,1,2,1,2,0,41326,aa66486163b6cbc25ea62a34b11c9b91,0,"Hunter and his brother Marley are big-boned. Hunter is white with brown spots while Marley is fully black. Hunter weighs 9 kgs and Marley is 7.2 kgs. They are very obedient and toilet trained on grass. Alert and good watchdogs too. Neutering and vaccination are compulsory, cost to be borne by adopter. Please call if you can give them a good home. They can be split up but if anyone can take both that would be great. November: Marley went missing in Ara Damansara. Sadly we can't find him and can only pray he is fine.",1ffe668f9,12.0,4,Black,Brown,White,Mixed Breed,Pointer,Selangor
656,1,Elsa And Belle,3,2.0,2.0,2,1,1,2,1,1,0,41326,aeb78e196b74d77222860a9b466255ce,0,"The remaining Disneys who need forever homes Elsa and Belle They are healthy, happy, energetic, full of love and would make lovely companions and family members. Do share and help me find them their forever homes. PM me if interested. Only SERIOUS adopters will be considered. TQ :-D",f19658d12,6.0,3,Black,Brown,White,Mixed Breed,Golden Retriever,Selangor
657,1,Lynx,13,1.0,3.0,2,1,1,2,1,1,0,41326,e24b1f073d9c3d18be61f5cc667640c5,0,"I have a year old puppy that is a hybrid of my Siberian Husky (Father) and Golden Retriever (Mother). Both the parents are pure breed large sized dogs with MKA cert. I only have 1 male puppy who is fully grown looking for a wonderful home. The puppy is not with me in Subang Jaya but with the previous adopter in Cheras. Due to change of circumstances, he has asked me to find a home for the puppy. I have with me the parents and Lynx's brother and sister. Anyone interested may visit me to see if they are serious about adopting Lynx (puppy for adoption) from the current owner. I am looking for anyone within Klang Valley with the means to spend RM or more per month to take care of Lynx. Please contact me if you are interested. BTW, I am an Indian so anyone calling me, please don't speak to me in Chinese, Malay or Tamil as I'm not very fluent in these languages.",c0503dd75,3.0,2,Black,Brown,White,Siberian Husky,Golden Retriever,Selangor
