,Type,Name,Age,Gender,MaturitySize,FurLength,Vaccinated,Dewormed,Sterilized,Health,Quantity,Fee,State,RescuerID,VideoAmt,Description,PetID,PhotoAmt,AdoptionSpeed,ColorName_x,ColorName_y,ColorName,BreedName_x,BreedName_y,StateName_x
287,2,â¿Fayja Blossomâ¿,10,2.0,3.0,3,1,1,1,1,1,0,41326,e62135526c27156b8479420aad166317,0,"""I was a breeder cat before being surrendered to my current foster mummy. I was unwanted because I was not good at taking care of my kittens and my very first litter of kittens all perished. I was never vaccinated nor taken out of my home and spent most of my life in a cage. Despite this, I have proven myself to be very trusting under foster care. I am eager to learn and crave attention in spite of some character quirks that require patience. Please read on to understand more about me."" -------------------------------------------------------------------- Details: - Female, 10 months old, mix of Coon (father) and Ragdoll (mother). Has a beautiful white + fawn coat with blue eyes. Character: - Fayja is a very loving girl and ADORES people. She has an outgoing personality and will adjust to any situation really quick. Loves to play, play, play and hardly tires herself at every invite! She enjoys being pet, stroked and even kissed (although not a fan of being carried). She will come to you when she wants a lap to lie on (she will struggle off if made to do so). - Fayja has a tendency to get overexcited whenever she sees humans and will roll around, purr and sometimes play-bite. She knows how to inhibit herself, however and will lick you afterwards. This instant excitement is probably from her previous life mostly caged - and lack of attention. She understands a simple firm ""no"" in such circumstances. - She has a jealous streak around other cats although she is curious (big NO for kittens), will do best as a single cat. She dislikes others being stroked or pampered in her presence, will lay herself and nuzzle as close as possible to her person to prove this point. - Fayja has been vaccinated, dewormed, spayed and given Advocate spot-on. She is not at all fussy about food and is very clever with the litter box. *** Note For Potential Adopters (PLEASE READ) *** - Fayja ""nips"" as a show of affection very often, hence experienced adult owners preferred (homes with children will not be suitable). - She needs a % indoor home. NO apartments (unless you have maintained a cat-safe environment for many years). - Premium food feeding only (no Whiskas, Friskies etc). Please inquire for more info, this is for any cats long term welfare. - Small reimbursement fee will apply, please inquire. Health card will be passed to successful adopter. Please drop me a text or WhatsApp if you feel that you may be just the right person to take this girl home. Thank you!",d9f692e74,6.0,2,Cream,Gray,White,Ragdoll,Maine Coon,Selangor
288,2,â¤ Jamaica Kiss â¤,1,2.0,2.0,2,2,1,2,1,1,100,41326,e62135526c27156b8479420aad166317,0,"Introducing sweet little Jamaica! ♥ Female kitten, almost 6 weeks old. Has a diluted-calico (blue instead of black) medium-hair coat (will develop) with beautiful hazel eyes. ♥ Absolutely loving girl! Stroke her, carry her, hold her, hug her, give her kisses, anything, she won't protest. :) Jamaica bonds closely to the people who pay her the most attention. ♥ Jamaica's very vocal despite her teeny-tiny voice. Has a lot to say especially when spoken to! She explores her space and can even jump onto significantly high places despite her size - her favorite being her human's lap. ♥ She is a follower as well and tags along behind feet - very purry and gives us massages with her little feet. She will need lots of attenion as she seeks comfort with people often. ♥ This girl is very clever with her little-box and eats her kibble independantly. She has been dewormed (still too young to be vaccinated) and is in good health. ***[IMPORTANT] Note for potential adopters*** ○ Jamaica must be kept % indoors for her own safety. Apartments should be cat-safe. ○ Spaying is compulsory (when she's older). ○ Premium food feeding only (no Whiskas, Friskies etc). Please inquire - this is for any cat's long term welfare. Please drop me an email or text (WhatsApp) if you feel that you may be just the right person for this girl. Thank you!",c9cab5e67,5.0,1,Cream,Gray,White,Domestic Long Hair,Russian Blue,Selangor
289,2,"FREE KITTENS. (URGENT, PLEASE READ)",1,3.0,,1,2,1,2,1,3,0,41326,f123745af12d52a752542bd325badda1,0,"My grandparents recently adopted a year old female cat. What's they didn't know was that the cat is pregnant with at least 3-6 cats. My grandparents do not have the time to look after these kittens, which are going to be born in a matter of weeks. So our vet suggested them to be aborted than be released into the streets. So instead of killing them, we are looking for good homes for the future kittens. If anyone is interested, please do contact me AS SOON AS POSSIBLE. We only have until this Sunday (1/ ) to make a decision for the cat. The mother is a very good natured and loving cat, which I'm sure the kittens will take after. When the kittens are born, you can come over and take your pick. Or even before they are born, you can come and have a look at the mother yourself. 1st number: (Leslie) 2nd number: (Joseph)",c18a1acc6,3.0,4,Brown,Cream,,Domestic Short Hair,Domestic Short Hair,Selangor
290,2,Misty,3,2.0,2.0,1,2,1,2,1,1,0,41326,7a30f3374d123b3121145df4b1096dde,0,Misty is a healthy happy go lucky kitten who is always very energetic and loves to play. She is friendly once she gets to know you and very lovable. She was rescued by a friend of mine who asked me to help take her in. She is kitty trained. I already have another cat at the moment and unable to care for her due to other commitments. Am looking for someone who really loves cats and is able to give her a good and loving home and look into her everyday needs. Those who are really serious and interested can contact me via the number given above. Kindly bring your own cage during collection. Thank you.,fbcadae16,6.0,2,Brown,Cream,White,Siamese,Domestic Short Hair,Selangor
291,2,Saffy (Saffron),1,2.0,2.0,2,2,2,2,1,1,0,41326,9e5b5dca43fbd39af3d5b885a8a1050c,0,"Hi, I have another adult female cat who had babies. They're all about 6 weeks old now so they should be able to be given away. This would probably be my last batch of kittens since I would finally want to spay my cat after this. I would like to keep them, but my current circumstances does allow me to so I'm hoping to find interested pet lovers. This one is named Saffron or Saffy for short. I named this batch after spices haha. At first she seemed meek but she's actually really friendly and curious and likes to walk and run around. She takes after her mother, Mimi. Saffy might need to be introduced to food slowly as she doesn't eat as much as her sibling, so be prepared with some kitten milk just in case and then give her wet food and slowly some dried ones. I'm currently training her and her siblings to use the litter box and it seems that they know where to do their business now so that's good. If interested in one, or more of them, please call/sms me at or email me. Unfortunately I don't have whatsapp, but if you need any additional pictures to be sent, please let me know your emails and I'll send them over.",24e0380f1,2.0,0,Brown,Cream,White,Calico,Domestic Short Hair,Selangor
292,2,Cherry,2,2.0,2.0,2,2,2,2,1,1,20,41326,87d72a1987bdd8659ce6c3bbd865eb18,0,"Hello there !! This is Cherry . I found Cherry at my grandmother ' s house on 5 th of March . Cherry is a very beautiful kitten . Cherry has mixed colours on her coat , the coat colour below her neck and all the way down to her legs are white . Cherry ' s eyes is light grey in colour with a hint of very very light green . Cherry is a very loving , friendly and cute kitten . The adoption fees will be RM 20 because Cherry will be coming along with her food and litter . Cherry is ready for her new loving owner :)",1b4224c51,4.0,1,Brown,Cream,White,Domestic Short Hair,Domestic Long Hair,Selangor
293,2,Cat 1,12,1.0,2.0,3,1,1,2,1,1,100,41326,88c2cd5c80653d4144ebfd833756f7a5,0,"this poor but handsome cat is a mix of siamese and long hair..he got long hair..very pretty one...it is just days before this, he got some sort of problems with his stomach, so, he turns thin..brought him to vet so, it should not be any problems if he keeps eating kibbles. just sms me if interested. COD in Klang Valley area.",020fbbc9d,2.0,4,Brown,Cream,White,Siamese,Domestic Long Hair,Selangor
294,2,Mocha,1,1.0,,1,1,1,2,1,1,0,41326,49083ec6c13e3256c66cdfb740c74f17,0,"Hello... From the time that I spent with Mocha, I found out he is a sweet, adorable, precious and slightly naughty kitten with a big appetite. I am looking for a parent for him that will provide a security of a home as well as a nurturing, caring and loving environment for him",24e5e366c,4.0,3,Brown,Cream,,Siamese,Tabby,Selangor
295,2,,3,1.0,1.0,1,1,1,2,1,1,0,41326,49083ec6c13e3256c66cdfb740c74f17,0,"He is a sweet, adoring, healthy and slightly naughty kitten that is looking for a home. I am looking for a fosterer or a parent for him that can provide him a home with love, caring and security.",88af83705,3.0,0,Brown,Cream,White,Siamese,Tabby,Selangor
296,2,Brown,2,2.0,2.0,3,2,2,2,1,1,100,41326,8480853f516546f6cf33aa88cd76c379,0,Brown is a 2+ month old ball of cuteness. She is energetic and playful. I rescued a couple of cats a few months ago but could not get them neutered in time as the clinic was fully scheduled. The result was this little kitty. I do not have enough space and funds to care for more cats in my household. Looking for responsible people to take over Brown's care.,5781e566b,1.0,1,Brown,Cream,White,Maine Coon,Tabby,Selangor
297,2,"Putih,brown,comel",1,2.0,1.0,2,2,2,2,1,1,30,41326,b990f8dcaa97abbc385bb78ff772ea84,0,Kitten -mencari tuan baru -sangat aktif dan suka main -sangat nakal... -diet wet food... -fee itu adalah untk beli makanan kucing yg lain.. Area Batu Caves........ -Putih (Taken) Comel (Taken) Tinggal Brown Calico perlukan tuan baru..,eb7fedf92,4.0,3,Brown,Cream,White,Domestic Medium Hair,Domestic Medium Hair,Selangor
298,2,Ebie,15,1.0,3.0,2,1,1,1,1,1,0,41326,d4c50da46bde55ab6b0eb670f1e9ba00,0,"Ebie was abandoned at our office corridor. He was cold, wet and shivering. We took him in, neutered and fostered him while waiting for his adopter to be ready. Alas, the adoption didn't work out due to adopter's daughter's allergy to fur. Ebie has then been living with us for almost a year. But our alpha cat is still unable to accept him. It breaks our heart to see him sad and trying hard to gain the alpha cat's interest. If there is a better home for Ebie, we would love to see him happier there. To spend some time with Ebie, please give me a call.",888116751,1.0,1,Brown,Cream,White,,,Selangor
299,2,Snowy,6,2.0,1.0,2,1,1,2,1,1,0,41326,17c39bf0ad57c537319984ef6cb72312,0,"I found her on the streets about 3 months ago and she was very frightened and hungry. Since I have cat food, I decided to feed her. Now she's a healthy and playful girl. She's very nice and likes rubbing against people. In other words, she's quite ""manja"". She knows when she does something wrong as she hides and peeks at you from her hiding spot after a scolding. She enjoys playing 'catching' and hide-and-seek. She'll look at you playfully and when you're near her, she'll turn around and run off, hoping you'll catch and play with her. She knows how to do her business in the cat litre. She has also started hunting for little insects such as lizards, cockroaches and small bugs! She'll grow up to be a great hunter, leaving a house with no visible insects! :)",5b0f07923,2.0,1,Brown,Cream,White,Siamese,Domestic Medium Hair,Selangor
300,2,No Name,2,2.0,1.0,2,2,2,2,1,1,100,41326,d835bced4bcedb46fe3ab60b5995fdbe,0,will be release back within 3 days will dewormed and will request for deposit to make sure the adopter spayed and vaccined,73680f695,2.0,4,Brown,Cream,White,Siamese,Domestic Medium Hair,Selangor
301,2,Abby,24,2.0,,2,1,1,1,1,1,0,41326,ce52b287b981205d8f9d3973f0bbc951,0,"Hi I'm Abby, the sweetest cat you could ever hope to meet. I can be a little shy at first meetings but soft words and the offer of a hand have me purring and cuddling like you wouldn't believe. I am spayed, vaccinated and litter trained. Won't you give me a chance to come live in your loving home?",8fc9d6c1a,2.0,2,Brown,Cream,,Siamese,Domestic Medium Hair,Selangor
302,2,Little Stacey,3,2.0,2.0,1,2,1,2,1,1,0,41326,0a0ab8c6be68d999ae909e71735bf6cd,0,"Little Stacey was a stray kitten that had been wandering the streets for roughly a week. I know because she has the loudest mews and I can hear her a few houses away. She was sleeping under cars, ON car tires and IN car engines far too much for my comfort. I keep worrying that she might get trapped in there or get run over one day. So I decided to rescue her and try to find a new home for her. Little Stacey was a lost kitten I think, there weren't other kittens and no female cats around that could look like her momma. She was always alone under cars or in drains. Stacey is a feisty little thing, she will hiss at strangers, but will not usually bite or fight back. She is a very vocal kitten, hyperactive and loves to play with anything and everything. Stacey can be manja at times but most of the time she will prefer to run around curiously to explore every nook and cranny. She had been dewormed, but not vaccinated. Litter trained, and eats Fussy cat wet food + Acana kibbles. Stacey is a brown tabby with no tabby markings on her body, just on the head, legs and tail. The tips of her ears are black, so is her tail, which I suspect is from a Siamese heritage. She has white paws, which is very cute. :) If interested, please e-mail me at or SMS me at. Please do not call!",a7a94dd33,5.0,1,Brown,Cream,White,Tabby,Siamese,Selangor
303,2,BOBBY & KAKAK,12,2.0,3.0,2,1,1,2,1,2,0,41326,8ed2fdc47e46f688e974ed84d9a05640,0,BOBBY & KAKAK is a loving pretty mummy cat. Please consider giving them a home where they will be treated like a queen. I have to let them go to the right person because my wife pregnant. Please do contact me at ASAP to adopt them..,11d741736,2.0,3,Brown,Cream,White,Domestic Short Hair,Siamese,Selangor
304,2,Smokey 2.0,20,2.0,1.0,1,2,1,1,1,1,30,41326,6f40a7acfad5cc0bb3e44591ea446c05,0,Loving cat loves to sleep n eat.,a80687cf1,3.0,4,Brown,Cream,White,Domestic Short Hair,Siamese,Selangor
305,2,"MiuMiu, Miko & Snow",12,3.0,,2,2,2,2,1,3,0,41326,76770eb6a079b47cfcf77ba0e0ef2621,0,Looking for kind soul/s who wants to adopt this beautiful mom (MiuMiu) with her two sweet kittens (Miko & Snow) aged around 4/5 months. Pls contact me for me details. Tq so much.,0ac3e7992,5.0,4,Brown,Cream,,Domestic Short Hair,Persian,Selangor
306,2,Tedora,73,2.0,2.0,3,1,1,1,1,1,400,41326,7ef621affecf46c4ba89d248b3f4646f,0,"Full Flat-Face Pique Nosed Persian Cat. She has a mustache shaped spot on her lips! Very affectionate, though shy at first. Extremely friendly with other pets. Strictly indoor cat. Neutered/spayed, vaccinated, de-wormed, litter-trained. I am unable to care for her due to a new housemate having cat allergy, I can even transport her to your place if it's within Klang Valley, price is negotiable. Tedora really loves your company and to play around with other pets. She will sleep in funny positions and is happy to laze around near you. She is a very gentle cat who will behave herself during showers, you won't find another cat that is as well-behaved and gentle as her. She will give you her everything and ask only for a little bit of your love.",5933da514,3.0,3,Brown,Cream,White,Persian,Persian,Selangor
307,1,Lovely Puppies,2,3.0,2.0,2,2,2,2,1,4,0,41326,25184a55b5ab6203e15df42feae46a11,0,The puppies are about 2 months old. they are currently staying at the fosterer house. All the puppies are healthy and playful.. Please contact Ms Saw at or Ms Yvonne at,9cda44cdf,8.0,2,Brown,Cream,White,Mixed Breed,Labrador Retriever,Selangor
308,1,"Cappucino,Milo,Milky,Browny,Lucky",4,3.0,2.0,1,2,2,2,1,5,0,41326,b13b9ebf3d547ac9f242cc6d77703544,0,"There are 5 wonderful puppies are abandoned by owner with their mother dog. there are around 4 months old and very charming, playful and healthy. there are very alert and aware of their territory. we have been feeding them but the we have many of neighbors who don't like dogs and at any time municipal will take these puppies. We are looking for serious adopters who can provide a good family to these puppies. they definitely can be an excellent family member. Please contact us via wats up, sms or call us for more information. Thank you for your kind attention.",b90e6ec69,6.0,3,Brown,Cream,White,Mixed Breed,Mixed Breed,Selangor
309,1,4 Pups 8 Weeks,2,3.0,2.0,2,1,1,2,1,4,0,41326,3b074cadd2350de62dca7056b9bab6f4,3,"FOR serious adopters only! If you are interested in adopting, kindly contact ==> Call/ SMS to Requirements for Adoption: ========================= All adoptions are subject to an interview and house check. Cost of vaccinations and neutering to be borne by adopter. Vaccinations and neutering/spaying at 6 months of age are COMPULSORY.",e27ac6865,13.0,3,Brown,Cream,White,Mixed Breed,Mixed Breed,Selangor
310,1,Louisa Girl,5,2.0,,1,1,1,1,1,1,0,41326,4d2400be2e2e78265f5c84345b7a3415,0,"Louisa girl were rescued from the street & are looking for a loving forever home! She is extremely lovable, smart & enjoy being cuddled! She's gonna grow up to be even more beautiful than this. Please help her to find her forever home by sharing this post widely. Please contact if you can ensure her a good life and we are sure what she will give you in return is what money can't buy. Adoption saves life! Txs!",80bf7a371,2.0,4,Brown,Cream,,Mixed Breed,Mixed Breed,Selangor
311,1,TimTams: Playful Pets+ Great Guards,12,1.0,2.0,1,3,3,1,1,2,0,41326,07184fe71e0dc6ad58406e228719fd21,0,"Thank God for sending a lovely family that fits the descrption of our ideal fosterer, and would do what i listed below for the dogs! Timtams are now part of a loving family of parents +3kids+a maid and loving the wonderful corner house with grass in the compound! ----- TimTams (one is Tim, one is Tam)- to make it easier to call them! Potential adopters should be able to commit to: 1) walking the dogs 2x a day (or keep them in secured bungalow/semi-d/corner house with vast area to roam, as they love running and playing) 2) spend time playing with them (they're still quite young, and will whine for attention unless given regular affection-time with keeper) 3) give fresh water daily & proper food (they eat kibbles) 4) keep shoes in proper shoe cabinet cos one of them is still displaying puppy behaviour of chewing shoes or moving them around (unless he gets adequate exercise and attention) They appear to be brothers, and was roaming Ara Damansara area when found. Plus points about these dogs: 1) trainable: know how to sit/shakehand/come 2) loves children and will play with kids - excellent FAMILY PETs! 3) chase cats (but don't attack them) 4) will bark at strangers - good alert dogs! 5) friendly to keeper and friends 6) great with older folks because of gentle nature - makes excellent FAMIlY PETs! 7) get along with other dogs, even male dogs (possibly because not fully sexually mature and also very gentle + playful in nature), so can join family with existing dogs. NOTE: Will only entertain genuine adopters who'd take either one or both dogs as family pets. They get along well with other dogs. Tim once ran up to an Alsation in my neighbourhood and I thought he'd be minced meat, but they got along fine! Tam was badly injured (possibly by other dogs) when he was rescued, so he'd need responsible owners who'd make sure he's kept in a safe environment.",eda8eecc6,20.0,3,Brown,Cream,White,Mixed Breed,Mixed Breed,Selangor
312,1,Little Frosty,2,1.0,2.0,1,1,1,2,1,1,0,41326,a042471e0f43f2cf707104a1a138a7df,0,Frosty is the only one left waiting to go to a good home. He is very adorable and do have a good temperament.You will never regret adopting him as he is very obediant. Visit www.everydoghasitsday09.blogspot.com for more puppies,faca11616,8.0,3,Brown,Cream,White,Mixed Breed,Mixed Breed,Selangor
313,1,Pet For Adoption,2,1.0,,1,1,1,3,1,2,1,41326,5c2d2a0c54c56087b2861d96db55f906,0,Super adorable puppies up for adoption,43021e4ed,2.0,2,Brown,Cream,,Mixed Breed,Mixed Breed,Selangor
314,1,,5,3.0,1.0,1,2,2,2,1,4,0,41326,c4a68a690110d668e7c6fff0d2084343,0,"Found 4-5 active, healthy pups available for adoption at SS2's morning market (near Nando's). Caretaker (not me) has too many puppies on hand and needs someone to take them in. She can be found at her market stall on weekdays from 7am to 12pm. Do PM me if you need more information on the location of the caretaker.",a6e25e889,5.0,4,Brown,Cream,White,Mixed Breed,Mixed Breed,Selangor
315,1,Waiting For You To Give Him A Name,2,1.0,2.0,2,3,3,2,1,1,0,41326,05fabcd5da274c0b654a575430d6a14b,0,was been rescued from a garbage bin this evening 13/7 8.30pm at taman sungai besi. the puppy is health and very playful too. i am not sure if the puppy been vaccinated or not. he really need a good home now.. Please give him a home and he really need someone to love him :(,6c61c33ee,4.0,0,Brown,Cream,White,Mixed Breed,Mixed Breed,Selangor
316,1,CREMO,1,1.0,2.0,2,1,1,2,1,1,0,41326,2bc582de6743ec43f6f4e8c585cc728b,0,"CREMO, ALONG WITH HIS 4 OTHER SIBLINGS WERE RESCUED RECENTLY AND NOW NEEDS A NEW HOME. IF YOU HAVE A PLACE IN YOUR HOME, AND MOST IMPORTANTLY YOUR HEART, THOMAS WOULD LIKE PERMANENT RESIDENCY his vaccinated and dewormed too, so his healthy and happy just for you/// TO ADOPT CREMO: CALL.. HASVEEN-",3dd6ea6bb,2.0,1,Brown,Cream,White,Mixed Breed,Mixed Breed,Selangor
317,1,Whitty,1,1.0,2.0,2,2,2,3,1,1,0,41326,793a857b0f2db4c0ed8fd9e38cc7cb5f,0,"Anyone would like to adopt these little kid for free? its roaming freely.. very active.. healthy.. urgently need home for him.. found this pup near my house.. im having four dogs at hm, could not take along these little pup with me. anyone would like to adopt? place near NSK, sentosa.. please do contact me...",3ae326dba,5.0,3,Brown,Cream,White,Mixed Breed,Mixed Breed,Selangor
318,1,4 Pups 6 Weeks,1,3.0,,2,1,1,2,1,4,0,41326,3b074cadd2350de62dca7056b9bab6f4,0,"FOR serious adopters only! If you are interested in adopting, kindly contact ==> Call/ SMS to Requirements for Adoption: ========================= All adoptions are subject to an interview and house check. Cost of vaccinations and neutering to be borne by adopter. Vaccinations and neutering/spaying at 6 months of age are COMPULSORY.",8132fabfd,11.0,3,Brown,Cream,,Mixed Breed,Mixed Breed,Selangor
319,1,Brownie,60,1.0,2.0,2,1,1,1,1,1,0,41326,f3155af0da46a8ca173639d02d05ea8e,0,Brownie is looking for a Forever Home...Loving gentle doggie. Suitable companion for elderly and children.,afefc6424,4.0,4,Brown,Cream,White,,,Selangor
320,1,UNNAMED,1,3.0,3.0,1,2,2,2,2,6,0,41326,9cc690612b50a95b7a1af2c422bcf1cf,0,"THE SUSPECTED FATHER IS A MOTOR VEHICLE WORKSHOP WATCHDOG. THEIR MOM GAVE BIRTH TO THEM AT A SECOND HAND CAR DEALER. THERE IS SOME MINOR SKIN INJURY ON SOME OF THE PUPPIES BUT NOT SERIOUS. PUPPIES ARE PLAYFUL, HOWEVER A LITTLE LACK OF NUTRITION AS THE MOTHER IS ALWAYS AWAY. THEY ARE NOW STILL LOCATED AT THE SECOND HAND CAR DEALER SHOP, VERY NEAR TO THE MAIN ROAD (MANY LORRIES AND CARS DRIVE PASS HERE EVERYDAY AS IT LEADS FROM THE PORT TO THE HIGHWAY. I AM AFRAID THEY WOULD BE WANDERING AROUND THE MAIN ROAD SOON AS THEY GET BIGGER AND MORE CURIOUS. URGENTLY NEED ADOPTERS FOR THESE PUPPIES.",b35c61109,3.0,4,Brown,Cream,White,Mixed Breed,Mixed Breed,Selangor
321,1,Charlie,4,1.0,2.0,1,1,1,2,1,1,0,41326,95481e953f8aed9ec3d16fc4509537e8,0,Charlie is an adorable boy found wandering the streets abandoned and lonely. All this boy needs is a good home. He is very loving and timid. Please call if you wish to welcome him through your doors and your hearts to this handsome boy. A must view,44dcffea3,2.0,3,Brown,Cream,White,Mixed Breed,Mixed Breed,Selangor
322,1,,1,3.0,2.0,2,2,2,1,1,5,0,41326,a81f9963807b4de039ae6d9a1649613a,0,"The puppies are ever loving and cuddly little ones in need of a forever home! They are witty, calm and very loving puppies and they are great with kids!",38c5d4e0e,12.0,4,Brown,Cream,White,Mixed Breed,Mixed Breed,Selangor
323,1,No Names Yet,2,2.0,3.0,2,1,1,2,1,1,0,41326,a3c9eaf175dbfa537ee9f1ccc68aa5d1,0,We rescued the mother not knowing of her pregnancy. She delivered a litter of 8 seven weeks ago. 3 white/cream n 2 brown. They have been vaccinated (1st dose n dewormed) mother is a terrier and father unknown. We are looking for loving homes for these adorable pups as we can't keep them due to space constraint and local town council rules. They are toilet trained ( in the garden).,49c5dbda7,6.0,1,Brown,Cream,White,Terrier,Mixed Breed,Selangor
324,1,Micky,2,2.0,2.0,1,2,2,2,1,1,0,41326,aa66486163b6cbc25ea62a34b11c9b91,0,"Micky is an adorable pup. Very gentle and playful as all pups are. Expected to be medium size estimated 15 kgs in adulthood. Vaccination and spaying are compulsory, cost to be borne by adopter. Please call if you can give her a good home.",822193428,6.0,3,Brown,Cream,White,,,Selangor
325,1,Milo & Siblings,2,3.0,2.0,1,2,1,2,1,6,0,41326,aa66486163b6cbc25ea62a34b11c9b91,0,"Milo and his siblings are adorable and active pups. There are 3 males and 2 females, all looking for a loving home. One of his sister Myla has been adopted.",8ca64b428,6.0,1,Brown,Cream,White,,,Selangor
326,1,Roxy,21,2.0,2.0,1,2,2,2,1,1,0,41326,81ac1b71c81d81aae2f8eb1bd9d4b4ba,0,Loving playful intelligent,b593502c5,1.0,0,Brown,Cream,White,Rottweiler,Mixed Breed,Selangor
