,Type,Name,Age,Gender,MaturitySize,FurLength,Vaccinated,Dewormed,Sterilized,Health,Quantity,Fee,State,RescuerID,VideoAmt,Description,PetID,PhotoAmt,AdoptionSpeed,ColorName_x,ColorName_y,ColorName,BreedName_x,BreedName_y,StateName_x
985,1,Doggie R2,5,2.0,2.0,2,2,2,2,1,1,0,41401,b770bac0ca797cf1433c48a35d30c4cb,0,rescuer-Agnes. Female-5 mths healthy. spay fees will be pay by the rescuer,46b2782d5,2.0,2,Yellow,Cream,White,Mixed Breed,Mixed Breed,Kuala Lumpur
986,1,Cutie,2,1.0,2.0,1,2,2,2,1,1,0,41401,b770bac0ca797cf1433c48a35d30c4cb,0,Rescue from Bdr Damai Perdana area. He can eat and drink itself. Healthy and smart.,3e0ce6020,2.0,1,Yellow,Cream,White,Mixed Breed,Mixed Breed,Kuala Lumpur
987,1,Shiro,24,1.0,2.0,1,3,3,1,1,1,0,41401,cd431467a017d5bce5f42daa746d7d08,0,"SHIRO - 2 year old male Labrador cross breed urgently looking for a new home. To adopt, kindly contact Maggie .",a75703051,3.0,3,Yellow,Cream,White,Labrador Retriever,Mixed Breed,Kuala Lumpur
988,1,Minnie,10,,2.0,2,1,1,1,1,1,1,41401,b1186c8c2c0f1bee0aeb34fffa25eef3,0,Description: Name: Minnie Sex: Female Breed: Husky and Golden Retriever Mixed Age: 10 months old It's sad to tell that I can't afford to keep her anymore. I'm a student. I gonna go the other place to study and I can't bring her along. I hope that she can get a new owner who can offers her everything better than me.,7aef49fb2,4.0,4,Yellow,Cream,,Husky,Golden Retriever,Kuala Lumpur
989,2,Dora And Ali,3,3.0,2.0,2,2,1,2,1,2,0,41401,d251569fb86590b1e9dea80eee2ddade,0,"Dora is a docile and active kitten. Her brother, Ali, is equally playful. They are also good with kids.",b64307878,8.0,4,Brown,Yellow,White,Domestic Long Hair,Domestic Short Hair,Kuala Lumpur
990,2,Mojie,3,2.0,1.0,1,2,2,2,1,1,0,41401,59de2a27de0d45ad9a3c3b21f618065b,0,My girl gave birth to 3 cute little kittens. 2 was already adopted. 1 was booked earlier but was backed out. So Mojie here has no friend to play with. She's reallyyy playful. I hope Mojie can find friends/owner she can play with.. :),7362590d5,1.0,2,Brown,Yellow,White,Domestic Short Hair,Domestic Medium Hair,Kuala Lumpur
991,1,Sweety,12,2.0,,2,1,1,1,1,1,0,41401,7684da1e1e099cfb54c4731849bd4cf7,1,"Clever, lively",86c412966,2.0,0,Brown,Yellow,,,Mixed Breed,Kuala Lumpur
992,1,4-Female,2,2.0,2.0,1,1,2,2,1,1,0,41401,31d676b846daf6f51c95445c08606f6a,0,"SIX Puppies are urgently looking for theirs forever home!!! They are 2 male and 4 female are born on 17 NOV with age of 2 months and 1 week big. Their mummy and daddy are mixed local breed dog. She is in healthy condition & vaccinated. she is active, cute and smart.",fc4d1c61e,1.0,1,Brown,Yellow,White,Mixed Breed,Mixed Breed,Kuala Lumpur
993,1,Blu,12,1.0,2.0,1,2,2,1,1,1,0,41401,cd431467a017d5bce5f42daa746d7d08,0,"DOG FOR ADOPTION - His name is Blu. Blu is about 1 year old, neutered and homeless. He is very sweet and loving but because of this he is not safe on the streets. His friendliness will make him a very easy target to the local councils and he will be euthanized if he is caught. If you have space in your heart and home to make him a member of your family which he well deserves, please contact .",afdc5f01d,1.0,4,Brown,Yellow,White,,,Kuala Lumpur
994,2,FREE CATS FOR ADOPTION,12,3.0,2.0,1,1,1,1,1,2,0,41401,73d0a40b6e19e1d4315d83dd287a0ff0,0,"Owner is moving overseas and son has asthma. She is seeking new loving homes for her furrbabies All cats have been spayed, neutered and fully vaccinated ADOPTION IS FREE",895f73f14,3.0,2,Black,Yellow,White,Domestic Short Hair,Domestic Short Hair,Kuala Lumpur
995,2,Please Adopt 2 Blind Kittens,2,1.0,2.0,1,2,1,2,2,2,0,41401,78ec79634d350f6850fdd4a335cab431,0,"2 weak kittens found at my back lane months ago.. have sent to vet & comfirmed : Black & white kitten : Blind :( Orange kitten : an operation may help to remove his eye one side membrane,but will put him at risk too due to his young age & health issues. *both kittens on eye drips at the moment.adopter need to cleans their eye daily with cotton pad(with warm water),beside their eye problems they are normal overall.they love to play.eat well,sleep well :) *will get them vaccine once they are ready. I hope there's someone will come along & adopt them.Pls contact me for further details,Thanks.",7e250a5f1,18.0,3,Black,Yellow,White,,,Kuala Lumpur
996,2,MiniTiger,3,2.0,1.0,1,2,1,2,1,1,0,41401,27083c7f0a040994ca84395f4b17d80b,0,"Mini Tiger ♥ Loving ♥ Friendly ♥ Playful ♥ Love rubs Met MiniTiger at guardhouse. Her bladder was wet. Guard claimed that she was there for the whole day while raining. She is very loving and brave kitty, friendly to people!",531f9b184,5.0,0,Black,Yellow,White,Domestic Short Hair,Domestic Short Hair,Kuala Lumpur
997,2,Cik Lat,6,2.0,2.0,1,2,1,2,1,1,0,41401,7a63e943b37e7be9da7901e147839fc5,0,Calico 6 Month Betina ekor panjang,e11190906,3.0,4,Black,Yellow,White,Domestic Short Hair,Domestic Short Hair,Kuala Lumpur
998,2,Melor,5,2.0,1.0,1,2,2,2,1,1,0,41401,363c725ea5fa97d8e5a353bef63f7d68,0,"Hi, Melor perlukan mummy / daddy baru. Melor ni pemalu sikit, tapi bila dah dibelai kemain manja lagi. Dia tak bising pun, tapi suka lari2 & lepak dekat port best je. Perhatian : Self pick only. Waktu adoption selepas pukul 10 malam & sila bawa carrier sendiri.",20819afd9,3.0,3,Black,Yellow,White,Domestic Short Hair,Domestic Short Hair,Kuala Lumpur
999,2,2 Little Kittens,3,2.0,2.0,1,2,2,2,1,2,0,41401,fb29a34287766692ddd61aff38f86d2e,0,KITTENS FOR ADOPTION ○ 2 and half months old ○ 2 Females (the calicos). The black one has been adopted. ○ able to eat independently ○ toilet trained ○ the female calico on the left of the male is very sociable ○ the female calico on the right of the male is sweet and gentle.,e8ee34b59,1.0,2,Black,Yellow,White,Domestic Short Hair,Domestic Short Hair,Kuala Lumpur
1000,2,Jane Doe,2,2.0,1.0,1,2,2,2,1,1,0,41401,e5a05c5a799f1ccc3bbb6bc025432ac6,0,"Salam Petlover Again, another round of beautiful stray female kitty Jane Doe found wondering near lrt. Was found by a friend and now being taken care Indah area. Healthy, a bit defensive..but after a while shes very manja. She is available for adoption, kalau ada yg sudi, bolehlah call  ye. Terima Kasih",f32959003,3.0,1,Black,Yellow,White,Domestic Short Hair,Domestic Short Hair,Kuala Lumpur
1001,2,Putera And Puteri,1,3.0,2.0,1,2,2,2,1,2,0,41401,ff221a39dd37f56405f180eca7559655,0,"I found them a busy road at bangsar. Mom maybe left them to search for food. But as the kitten out from the hideout and exposing to the car, I rescue them. Both are around 3-4 weeks. Still need to feed with milk like every 3 hours. One is a male, one is female, both were very active and loud. Unfortunately I can not take care them for very long as I also have big Male Maine Coon cat who doesn't really likes them. My House owner aka My Boss actually don't like any pets inside the house. I want to keep them, but the kitten are very loud and scare my other cats. Help me to save this lovely kitten.",70a33ed88,3.0,1,Black,Yellow,White,Domestic Short Hair,Domestic Short Hair,Kuala Lumpur
1002,2,Chichi's Kittens,2,3.0,1.0,2,2,2,2,1,4,0,41401,e3ed2ff1f9caa14bcd6c89a97def279e,0,"Hey guys, so these are another 4 of my kittens for adoption. They are absolutely free to adopt. I won't charge you anything. They can eat solid foods already. So you can feed them normally. If you guys wanna take a look on the kittens, you guys can give me call or SMS me: Najla -",7ea900f4d,1.0,2,Black,Yellow,White,Domestic Medium Hair,Domestic Short Hair,Kuala Lumpur
1003,2,Kuning's Kittens,1,3.0,,2,2,2,2,1,4,0,41401,e3ed2ff1f9caa14bcd6c89a97def279e,0,"Hey guys, so I have these 4 kittens for adoption. They are absolutely free to adopt. I won't charge you anything. They can eat solid foods already. So you can feed them normally. If you guys wanna take a look on the kittens, you guys can give me call or SMS me: Najla -",288edef23,3.0,2,Black,Yellow,,,,Kuala Lumpur
1004,2,Cute Stray Cats,24,3.0,2.0,2,3,3,3,1,3,0,41401,376858ca461d35cadc69f3544505579e,0,they are all stray cat but healthy,3f5f5782f,1.0,4,Black,Yellow,White,American Shorthair,Domestic Short Hair,Kuala Lumpur
1005,2,Lalila,3,2.0,1.0,1,2,2,2,1,1,0,41401,5309d1656533a721e4e8b9ca1d120294,0,"She is very affectionate, docile, smart, friendly and loving. Not picky no food. I found her at my apartment carpark, skinny and hungry. have been feeding her for past week or so and she looks much better and gain some weight too. I think she will make a very good companion cat.",a575d70f3,2.0,3,Black,Yellow,White,Tortoiseshell,Domestic Short Hair,Kuala Lumpur
1006,2,Timmy,4,1.0,1.0,2,1,1,2,1,1,0,41401,0dd64a1285d0efc6e32098d0a87ccbab,0,"Timmy was found in a box with another of his 3 siblings. Out of them,only 2 of them manage to live due to the lack of mother's milk. He is now 4 months old, healthy and having a loving character but desperately need a new owner to give him a new home. :)",b319a0cd7,1.0,2,Black,Yellow,White,Tabby,Domestic Medium Hair,Kuala Lumpur
1007,2,Stormtroopers Of The Caribbean,1,3.0,1.0,2,2,2,2,1,2,0,41401,c527f5c0d229394f90c927ea38189c94,0,Too many cats in a small room of apartment will cause sanitary issues. Hope there are kind hearted and reaponsible adopters will take good care of these kittens Preferable self collect on Wednesday and Friday 8.30 - 9pm.,0c4c55b39,2.0,3,Black,Yellow,White,Domestic Short Hair,Domestic Medium Hair,Kuala Lumpur
1008,2,Beautiful Sisters For Adoption,36,2.0,2.0,1,1,1,1,1,2,0,41401,3bd0ccb3fbc71838f0a25077ac9a7f1c,0,"Two sisters for adoption, need a new loving home for personal reasons. They cannot be separated. They are microshiped, vaccinated, neutered and health checked. They are 3 years old. We are willing to Help with transportation or any other arrangements if needed You will also get free, 2 litter boxes. Pm me if you are interested",f05dae9bb,3.0,4,Black,Yellow,White,Domestic Medium Hair,Domestic Medium Hair,Kuala Lumpur
1009,2,2 Abadoned Kittens,1,2.0,2.0,2,2,2,2,1,1,0,41401,78ec79634d350f6850fdd4a335cab431,0,found this 2 kittens in company warehouse.believe abandoned by their mama cat.looking for a home which able to take in both together. Pls sms/whatsapp me if you like to give them a loving home. *Adopters must agree to spay/neuter kittens. *kitten still need bottle/syringe feeding every 3-4 hrs.TQ,fcffea7c0,8.0,2,Black,Yellow,White,Domestic Medium Hair,Domestic Medium Hair,Kuala Lumpur
1010,2,Aggie,2,1.0,,2,2,1,2,1,1,0,41401,b5950e3453c98daba8642f721ce85ba9,0,"I just found and caught a stray kitten at the back of my kitchen. It was raining heavily and the little kitten was all wet and hungry. I waited for hours to see any sign of the mother cat but there is none. So I believe that the little kitten is abandoned by the mother cat. Anyway, I managed to catch the little kitten and currently he/she is in the cage. I am still unable to hold the little kitten as he/she is still afraid of human contact. So, I am unable to know the little kitten's gender yet. My hunch is that the little kitten is a female :) I am looking for any potential adopter who is willing and kind enough to adopt this little kitten. The potential adopter has to be very patience with this little kitten as he/she is afraid of human. I believe that with tender loving care and patience, the little kitten will turn out to be a wonderful companion for the potential adopter. So, if any of the genuine adopter who is willing and able to care for this little kitten, please give me a call . Thank you. 1/3/16 Its been a week since I rescued this kitten and I found out that she's really a female and so I named her ABBIE. She's still wary of strangers but she's comfortable with me to the extend that she allows me to carry her on my lap and clip her nails. I hope that as time progresses, she will be more open to her surroundings and other people. 4/3/16 I think the kitten is male now that I have seen a little 'hump' near his rear end. So I am changing his name from Abbie to Aggie. 😊 9/3/16 Aggie is doing very well and quite playful. Hope he will get a new family soon.",0d653b602,12.0,4,Black,Yellow,,Calico,Domestic Medium Hair,Kuala Lumpur
1011,2,Cici,3,2.0,1.0,1,2,2,2,1,1,0,41401,201a62feef68a12169a0d15c822ecfaf,0,"miley and cici are very active, friendly and they love human so much. They are a perfect duo for you who wants an active and playful cat.",6cdfd6a41,4.0,4,Black,Yellow,White,Domestic Short Hair,Siamese,Kuala Lumpur
1012,2,Pirate,5,2.0,2.0,1,2,2,2,1,1,0,41401,ae18d736ba43194dfefc8dd19fabdeb4,0,- Bengal + Persian Mix (not dominant) - Food Iams - toilet Trained - Urgent call/whatsapp :,59047a5a1,5.0,2,Black,Yellow,White,Persian,Bengal,Kuala Lumpur
1013,2,Matta,3,2.0,2.0,1,2,2,2,1,1,0,41401,ae18d736ba43194dfefc8dd19fabdeb4,0,- Bengal + Persian Mix (not dominant) - Food Iams - toilet Trained - Urgent call/whatsapp :,4158fbb67,1.0,3,Black,Yellow,White,Persian,Bengal,Kuala Lumpur
1014,1,3 Puppies,4,2.0,2.0,1,2,2,2,1,3,0,41401,337808e58e17ec60109b75a124d0e8c9,0,Rescued 3 puppies in cheras. Puppies are looking for home... They are beautiful & good. Appreciate if anyone willing to adopt them. Please call Chloe Lim,eea42fc56,0.0,4,Black,Yellow,White,Mixed Breed,Mixed Breed,Kuala Lumpur
1015,1,Candy TNRM,9,2.0,2.0,1,2,1,1,1,1,0,41401,cd431467a017d5bce5f42daa746d7d08,0,"Super cute rescued puppy for adoption. If you can give her a caring, loving, forever home please call or",c23b6bbf6,2.0,4,Black,Yellow,White,Pointer,Mixed Breed,Kuala Lumpur
1016,1,Milo,7,1.0,2.0,2,1,1,1,1,1,0,41401,a52131699bc8ae1a76da9109a968eebe,0,"Hello everyone! My name in Milo, I am a super cute adorable male with a zest and curiosity for life. I am cheeky, playful, kind, loving and like nothing more than keeping people company and receiving cuddles and tummy rubs. I am also cool with cats and other doggies too! I am currently being fostered by Simon's friend, but I don't have much time... Please, if you are reading this, and think you might be able to foster me or even better give me a loving forever family home, contact Simon and I promise I will love you forever and ever! Looking forwards to meeting you, Love, Milo.",b7ea489ae,5.0,2,Black,Yellow,White,German Shepherd Dog,German Shepherd Dog,Kuala Lumpur
1017,1,Lightning,2,2.0,2.0,1,2,1,2,1,1,0,41401,864cf39774b379d9bc93878c60445000,0,"Two months ago I rescued a pregnant stray (black and white border collie mix). This adorable female pup is the result. She has white hair on black skin which makes her fur look speckled. We researched and found that this characteristic is common in border collies (blue merle). We named her Lightning because in a litter of 5, she is the most active, playful and intelligent. She is now 2 mths old, been dewormed and is looking for a loving,forever home.",88db34068,3.0,1,Black,Yellow,White,Mixed Breed,Border Collie,Kuala Lumpur
1018,2,Jade & Mae,5,2.0,1.0,1,1,1,2,1,2,10,41401,bebdf0600d5028c1395ae625c9d5a47c,0,"Sweet n nice kitten,jade is a big sister,she would'nt fight with the other cat.for mae she is a shy cat and playfull.i hope someone can adopt both together..bcox they like to stick together..",353c89ed3,12.0,3,Golden,Yellow,White,Domestic Short Hair,Domestic Short Hair,Kuala Lumpur
1019,2,,0,2.0,1.0,1,2,2,2,1,6,0,41401,94b286188745c92c0afd22aa3d7c40be,0,"Six kitten, still with the mother, it's in the mamak shop, I'm just paying small fundings to look after them, soon they need to be adopted or the condo management will throw them at rubbish so if anyone wants to adopt this kittens kindly contact me or text me,, serious adopters needed no time wastes. Thx. I will try my best to support,",9598a1528,0.0,4,Black,Brown,White,Domestic Short Hair,Domestic Short Hair,Kuala Lumpur
1020,2,5 Newborn Kittens,0,3.0,2.0,1,2,2,2,1,5,0,41401,78ec79634d350f6850fdd4a335cab431,0,surrogate mama cat urgently needed for these 5 newborn kittens. or anyone willing to Adopt/Foster do contact me. tqvm!,0f80c9dc5,1.0,2,Black,Brown,White,,,Kuala Lumpur
1021,2,Melvin & Percy,48,1.0,3.0,1,1,1,1,1,2,0,41401,e015aee9a0cc17c87705f9cde1771e63,0,"Melvin and Percy are gentle affectionate cats, fully vaccinated and in good health. My wife and I have recently had a baby who appears allergic to cats and so we need to find them a new home. They are lovely animals and would make any new owner very happy.",ed97d1485,1.0,4,Black,Brown,White,Domestic Short Hair,Domestic Short Hair,Kuala Lumpur
1022,2,Sweety Kittens,1,3.0,2.0,1,2,2,2,1,6,100,41401,186e4788b805ba9cbaca6024e979c96f,0,I found this cat 6 kittens in my condo currently taking care but want responsible owners for them can be adopted seperately or toghter as well,62eb0363d,3.0,4,Black,Brown,White,Domestic Short Hair,Domestic Short Hair,Kuala Lumpur
1023,2,Kepong Kitties,2,3.0,1.0,1,2,1,2,1,2,0,41401,c00756f2bdd8fa88fc9f07a8309f7d5d,0,3 cute little kittens for adoption. stray neighbourhood cat gave birth in my place.. the mother cat will be spayed in a few weeks. very playful and healthy,bf6ef8c07,5.0,3,Black,Brown,White,Domestic Short Hair,Domestic Short Hair,Kuala Lumpur
1024,2,Cutey Kitties,2,3.0,,1,2,2,3,1,2,1,41401,6a0248993510b02efc3f0800c37a86f6,0,"2 kittens to be adopted: 1 female tabby; and 1 male light brown. The kittens are the third generation of the cat family. Playful and potty-trained. Need to let them go because I've already have two adult cats. Kitties currently reside in Gombak, Kuala Lumpur. Interested? Please text me via Whatsapp or SMS. Calls won't be entertained. Thankin' you in advance. :)",e01e4a2fb,5.0,2,Black,Brown,,Domestic Short Hair,Domestic Short Hair,Kuala Lumpur
1025,2,Tompok & Kecik,120,2.0,3.0,3,3,3,3,1,2,50,41401,32f6586d5be7d600a5aebb7b416b440e,0,Tompok adalah ibu kepada Kecik. Sekarang Tompok pregnant lagi. Terlalu manja dan sering dihalau oleh orang flat secara kasar. Tolonglah adopt mereka. Risau lahir nanti anak-anak Tompok mati lagi :'(,3cc6084ca,1.0,4,Black,Brown,White,Domestic Long Hair,Domestic Short Hair,Kuala Lumpur
1026,2,Issebelle,1,2.0,1.0,1,2,2,2,1,1,0,41401,2f29e4131291f6505d0cf6949f3a8e33,0,"Kucing ni aku jumpa dekat bilik tv kolej aku. Maybe orang buang. Sebab dalam seminggu ni dah 2 ekor kucing budak kat blok ni jumpa. Jumpa semalam (29/9/). Calico color. Manja. Ada Kutu sikit. Ada Flu juga. Boleh jalan dah. Bulu dia macam pendek. Tapi tak pasti jugak. Sebab macam tercacak3. Nak kata sebab tak mandi, dah mandikan pagi tadi. So, sape yang amik nanti, tunggu jela sampai dia besar. We'll see how she looks like..;) *mari adopt issebelle*",2f4c22fec,5.0,1,Black,Brown,White,Domestic Medium Hair,Domestic Short Hair,Kuala Lumpur
1027,2,Cute Fluffy Kitten,1,,1.0,2,2,1,2,1,1,0,41401,5ac530c66292db2bf05c62817768da22,0,"The kitten is tri-coloured and semi-Persian. She's about 3 weeks old which is why we haven't spayed her. If you want her spayed, you can adopt her and when she's old enough we'll bring her to the vet to be spayed. My friend found her in the garbage and took her to the vet. I fostered her and now she is currently being fostered by my cousin. She's very small and playful. her bites aren't painful (to me). Scratches just feel like feathers falling on you. She's currently being fed soft food and milk. She has already been taken to the vet and taken her medicine but we will take her to the vet on the 12th of June again to be absolutely sure she is worm-free. I don't know for how long my cousin can keep her :/ hoping to find a loving owner for her as soon as possible. If interested, you can contact me or Nicole (rescuer) at :) P.S. she is extremely cute.",143027239,2.0,1,Black,Brown,,,,Kuala Lumpur
1028,2,Prosperity Kitty (PK),2,2.0,2.0,2,1,1,2,1,1,10,41401,e046c5fbbbca0cea42b391a56c1be33e,0,"Prosperity Kitty is my name, being super cute is my game! I was rescued when a kind human noticed my frightened little self attempting to cross the road. I am very healthy thankfully and looking for a loving home. This darling of a kitten is vaccinated and ready for your love! Please open your heart and home to experience friendship and companionship. Upon adoption, we will be happy to cover any spaying costs once kitty is old enough. Your kindness is most appreciated and we are sure, she will bring joy, happiness, luck and prosperity to anyone who opens their heart to her!!",e4eb08c79,3.0,4,Black,Brown,White,Domestic Medium Hair,Domestic Long Hair,Kuala Lumpur
1029,2,Cats And  Kittens For Adoption,36,1.0,3.0,2,1,1,1,1,4,0,41401,aab6a7b87edc56e6db4d992afb7fce10,0,i have 2 male adult cats for adoption and 2 male kitten for adoption. the 2 males are both around 3 years old. both neutered and can be adopted separately. healthy and loves human companions. the 2 male kittens are mixed siamese with British shorthair. 4 months old and already been vaccined and dewormed. very active and healthy also loves human companion. letting them go as i have no time to look after them as i am concentrating on my mom that is not feeling well due to her aging. any enquiries please whatsapp me directly - firdaus thank you,890e7be2b,4.0,4,Black,Brown,White,British Shorthair,Domestic Long Hair,Kuala Lumpur
1030,2,Tsuki,3,2.0,,2,1,1,2,1,1,0,41401,b31b0f9de45578d40d6484f34d8a8a5d,0,"Rescue her 2 months back. Wandering around with no mother. When first met her, she was sick, not enough nutrients, got ringworms on her ears, worm in digestive system and she got scar on her nose. But we took care of her, took her 4 times to vet, got her vaccinated twice, clear from ringworms and she's perfectly healthy and cheerful now. :) She's litter trained, ate grain free kibbles and tuna or boiled chicken. So fat now :) She's looking for permanent home and loving pet parents to adopt her. Adoption fees are free, as long as new parents willing to take care of her & spay her when she's 5 or 6 months. Please whatsapp or sms (no calls) if interested. Available to send her to any place in Klang Valley.",b869dec56,10.0,1,Black,Brown,,Domestic Medium Hair,Tabby,Kuala Lumpur
1031,2,Abu & Atan,5,1.0,2.0,1,2,2,2,1,2,0,41401,8e983ee25c1e67b1b0fa479c32708235,0,"A kitten that come to my house and i feed them, hope they can find good owner.",6a3607d09,2.0,4,Black,Brown,White,,,Kuala Lumpur
1032,2,Mr Hugo,32,1.0,2.0,2,3,3,3,1,1,0,41401,9263cd15082a746f5cc4efa07d867efd,0,"Mr Hugo is a wanderer, sometimes he sleeps near the back alley of a kindergarden, sometimes he jumps up on top of the roof, he travels around the neighborhood always looking for food and shelter. He is a friendly cat. Mr Hugo has a very sweet and cute meow voice, all he need is just some food and shelter, if you have heart of gold to provide him a small space of accommodation with some food, pls email or contact me thru petfinder.",ee7d6cf3f,1.0,4,Black,Brown,White,Bengal,Oriental Short Hair,Kuala Lumpur
1033,2,Si Kental & Si Manja *Urgent*,1,3.0,1.0,1,2,2,2,1,2,0,41401,2f29e4131291f6505d0cf6949f3a8e33,0,"They can be either DSH or DMH. Not sure which one. Since they are still small. These 2 Kittens need home urgently! Mereka sangat comel. If you are interested to adopt one of them, please let me know. Do email me or call me. No sms will be entertained. *Still under treatment, they have some fleas(ligat main aci ligan *phew), little fungus and ear mite problem. Should recover(*pray) within 2-3 weeks.Kalau berminat nak adopt, kena tunggu 2-3 minggu sebab nak pulihkan mereka dulu. Pray for that people* p/s: Si ayu will be adopted by me. ;) update 8/: si kental is release for adoption again as the previous adopter tak jadi nak amik pulak..hhuhu..sadis sungguh..mari adopt kental jom! /: the only one left is Kental..anyone? kental ni kucing yg bijak taw..manja pulak..please consider in adopting black cat macam kental ni..;) /: Kental is no longer on adoption..he is staying in my house with Ayu..and finally, i've made up my mind..i want to keep kental as my pet..i just love him..thanks for anyone who is interested with him..i am sorry..",a89005005,11.0,2,Black,Brown,White,Domestic Short Hair,Domestic Medium Hair,Kuala Lumpur
1034,2,Mijiang,1,2.0,1.0,1,2,2,2,1,4,0,41401,e62478a13ba1e6547e5e50c8892f50ee,0,"There are four kittens who rescue by one of the rescuer and currently was temporary take care by rescuer at Pandan Indah.. There are too many cats that the rescuer have to take care so these four cats only can be temporary foster by rescuer and we wish to get a serious people to adopt those kitties.. If you are interested, please provide your name, age and job for us to make sure that you have the ability to adopt these kitties.. I believe they can bring lots of joy and happiness to you and your family if they could be one of your family ♥️",7b75b46ea,2.0,4,Black,Brown,White,,,Kuala Lumpur
1035,2,,2,3.0,2.0,2,2,2,2,1,2,0,41401,bcbfef3dc16242a694cfa110b07b8746,0,Both are very active and adorable. Most likely to be male [I can't really tell] *Both must be adopted together*,1f0e01c1d,4.0,1,Black,Brown,White,Domestic Medium Hair,Domestic Medium Hair,Kuala Lumpur
1036,2,Mao Mao æ¯æ¯,1,3.0,2.0,2,2,2,2,1,2,0,41401,d875085cf780b229007fb6af11ac3836,0,"It was found in a abandoned factory, actually there's 5 / 6 kitten, but 2 are dead cause by month cat doesn't know taking care of them, can only save 1 due to can't afford.. At the moment kitten settle down in pet shop, if fail to find adopter will release back to street after a month. 在一个废了的工厂区捡到的，完全没有遮掩物，其实有五六只小猫，其中两只已经升天了。我的能力范围只能救一只。猫妈咪不会照顾小猫，屁股粘着大便都没被舔掉。现在小猫在宠物店，如果不能成功被领养，将会被逼放回街上。 From : Jess",75f7beaf2,5.0,1,Black,Brown,White,Domestic Medium Hair,Domestic Medium Hair,Kuala Lumpur
